{
  "schema_version": 1,
  "case_id": "golden_single_round",
  "tenant_id": "11111111-1111-4111-8111-111111111111",
  "auction": {
    "auction_id": "00000001-0000-4000-8000-000000000001",
    "mode": "single_round_spot",
    "bid_close_at": "2025-02-01T12:00:00Z"
  },
  "policy": {
    "version": 1,
    "currency": "USD",
    "service_risk_cap": "0.1500",
    "service_risk_applies_to": [
      "priority"
    ],
    "max_carrier_share": "0.2500",
    "tie_break": [
      "total_score_micros",
      "bid_amount",
      "submitted_at",
      "bid_id"
    ]
  },
  "loads": [
    {
      "load_id": "00000101-0000-4000-8000-000000000101",
      "equipment_type": "REEFER",
      "capacity_units": 1,
      "reserve_price": "1600.00",
      "service_priority": "standard"
    },
    {
      "load_id": "00000102-0000-4000-8000-000000000102",
      "equipment_type": "REEFER",
      "capacity_units": 1,
      "reserve_price": "1600.00",
      "service_priority": "priority"
    },
    {
      "load_id": "00000103-0000-4000-8000-000000000103",
      "equipment_type": "DRY_VAN",
      "capacity_units": 1,
      "reserve_price": "1600.00",
      "service_priority": "standard"
    },
    {
      "load_id": "00000104-0000-4000-8000-000000000104",
      "equipment_type": "DRY_VAN",
      "capacity_units": 1,
      "reserve_price": "1600.00",
      "service_priority": "standard"
    }
  ],
  "carriers": [
    {
      "carrier_id": "00000201-0000-4000-8000-000000000201",
      "status": "active",
      "capacity_units": 1,
      "equipment_types": [
        "REEFER",
        "DRY_VAN"
      ],
      "service_risk_micros": 200000
    },
    {
      "carrier_id": "00000202-0000-4000-8000-000000000202",
      "status": "active",
      "capacity_units": 1,
      "equipment_types": [
        "REEFER",
        "DRY_VAN"
      ],
      "service_risk_micros": 60000
    },
    {
      "carrier_id": "00000203-0000-4000-8000-000000000203",
      "status": "active",
      "capacity_units": 1,
      "equipment_types": [
        "REEFER",
        "DRY_VAN"
      ],
      "service_risk_micros": 70000
    },
    {
      "carrier_id": "00000204-0000-4000-8000-000000000204",
      "status": "active",
      "capacity_units": 1,
      "equipment_types": [
        "REEFER",
        "DRY_VAN"
      ],
      "service_risk_micros": 80000
    }
  ],
  "eligible_bids": [
    {
      "bid_id": "00000301-0000-4000-8000-000000000301",
      "load_id": "00000101-0000-4000-8000-000000000101",
      "carrier_id": "00000201-0000-4000-8000-000000000201",
      "bid_amount": "1450.00",
      "submitted_at": "2025-02-01T11:50:00Z",
      "valid_until": "2025-02-01T13:00:00Z",
      "total_score_micros": 100000
    },
    {
      "bid_id": "00000302-0000-4000-8000-000000000302",
      "load_id": "00000101-0000-4000-8000-000000000101",
      "carrier_id": "00000202-0000-4000-8000-000000000202",
      "bid_amount": "1500.00",
      "submitted_at": "2025-02-01T11:51:00Z",
      "valid_until": "2025-02-01T13:00:00Z",
      "total_score_micros": 110000
    },
    {
      "bid_id": "00000303-0000-4000-8000-000000000303",
      "load_id": "00000102-0000-4000-8000-000000000102",
      "carrier_id": "00000201-0000-4000-8000-000000000201",
      "bid_amount": "1300.00",
      "submitted_at": "2025-02-01T11:52:00Z",
      "valid_until": "2025-02-01T13:00:00Z",
      "total_score_micros": 120000
    },
    {
      "bid_id": "00000304-0000-4000-8000-000000000304",
      "load_id": "00000102-0000-4000-8000-000000000102",
      "carrier_id": "00000202-0000-4000-8000-000000000202",
      "bid_amount": "1400.00",
      "submitted_at": "2025-02-01T11:53:00Z",
      "valid_until": "2025-02-01T13:00:00Z",
      "total_score_micros": 125000
    },
    {
      "bid_id": "00000305-0000-4000-8000-000000000305",
      "load_id": "00000103-0000-4000-8000-000000000103",
      "carrier_id": "00000202-0000-4000-8000-000000000202",
      "bid_amount": "1000.00",
      "submitted_at": "2025-02-01T11:54:00Z",
      "valid_until": "2025-02-01T13:00:00Z",
      "total_score_micros": 130000
    },
    {
      "bid_id": "00000306-0000-4000-8000-000000000306",
      "load_id": "00000103-0000-4000-8000-000000000103",
      "carrier_id": "00000203-0000-4000-8000-000000000203",
      "bid_amount": "1100.00",
      "submitted_at": "2025-02-01T11:55:00Z",
      "valid_until": "2025-02-01T13:00:00Z",
      "total_score_micros": 135000
    },
    {
      "bid_id": "00000307-0000-4000-8000-000000000307",
      "load_id": "00000104-0000-4000-8000-000000000104",
      "carrier_id": "00000204-0000-4000-8000-000000000204",
      "bid_amount": "1200.00",
      "submitted_at": "2025-02-01T11:57:00Z",
      "valid_until": "2025-02-01T13:00:00Z",
      "total_score_micros": 140000
    },
    {
      "bid_id": "00000308-0000-4000-8000-000000000308",
      "load_id": "00000104-0000-4000-8000-000000000104",
      "carrier_id": "00000204-0000-4000-8000-000000000204",
      "bid_amount": "1200.00",
      "submitted_at": "2025-02-01T11:57:00Z",
      "valid_until": "2025-02-01T13:00:00Z",
      "total_score_micros": 140000
    }
  ],
  "excluded_bids": [
    {
      "bid_id": "00000309-0000-4000-8000-000000000309",
      "load_id": "00000101-0000-4000-8000-000000000101",
      "carrier_id": "00000204-0000-4000-8000-000000000204",
      "bid_amount": "1300.00",
      "submitted_at": "2025-02-01T12:00:01Z",
      "exclusion_code": "BID_LATE"
    },
    {
      "bid_id": "00000310-0000-4000-8000-000000000310",
      "load_id": "00000102-0000-4000-8000-000000000102",
      "carrier_id": "00000203-0000-4000-8000-000000000203",
      "bid_amount": "1250.00",
      "submitted_at": "2025-02-01T11:40:00Z",
      "exclusion_code": "EQUIPMENT_INCOMPATIBLE"
    },
    {
      "bid_id": "00000311-0000-4000-8000-000000000311",
      "load_id": "00000103-0000-4000-8000-000000000103",
      "carrier_id": "00000201-0000-4000-8000-000000000201",
      "bid_amount": "900.00",
      "submitted_at": "2025-02-01T11:41:00Z",
      "exclusion_code": "CARRIER_SUSPENDED"
    }
  ]
}
